{
  "schema_version": 1,
  "module_id": "windows-provider",
  "purpose": "Windows provider boundary; current implementation is a compile-time scaffold for later native telemetry.",
  "paths": [
    {"path": "src/platform/windows/WindowsMetricProvider.hpp", "lifecycle": "implemented", "provenance": "authored"},
    {"path": "src/platform/windows/WindowsMetricProvider.cpp", "lifecycle": "implemented", "provenance": "authored"}
  ],
  "contracts": ["src/core/MetricProvider.hpp"], "validators": [], "tests": [], "runtime_evidence": []
}
